IdReparacion,IdMoto,IdUsuario,Descripcion,Estado,FechaInicio,FechaFin,Total,Fase
2438,4538,1533,mantenimiento preventivo en evaluación y evaluación y verificación completa.,Finalizado,2026-03-08 00:00:00,2026-03-08 00:00:00,4540,Cliente informado
2439,4938,1938,optimización del sistema escaneo y chequeo según solicitud del cliente.,Finalizado,2026-03-13 00:00:00,2026-03-16 00:00:00,1344,Cliente informado
2440,1169,708,revisión completa de motor de arranque y alternador y verificación completa.,Finalizado,2026-03-14 00:00:00,2026-03-18 00:00:00,3562,Entregado
2441,4146,1331,instalación y calibración de lubricacion y balanceo por falla detectada.,Finalizado,2026-03-04 00:00:00,2026-03-06 00:00:00,2611,Entregado
2442,3979,4752,optimización del sistema escape deportivo y gps según solicitud del cliente.,Finalizado,2026-03-18 00:00:00,2026-03-21 00:00:00,3342,Entregado
2443,4645,1560,mantenimiento preventivo en frenos y transmisión debido a desgaste.,Finalizado,2026-03-15 00:00:00,2026-03-16 00:00:00,4783,Cliente informado
2444,3768,3163,instalación y calibración de falla y inspección incluyendo ajuste final.,Finalizado,2026-03-18 00:00:00,2026-03-21 00:00:00,5380,Entregado
2445,2384,4613,revisión completa de luces y alternador con pruebas posteriores.,Finalizado,2026-03-11 00:00:00,2026-03-13 00:00:00,2578,Entregado
2446,1650,3127,ajuste técnico de chip y escape deportivo y verificación completa.,Finalizado,2026-03-19 00:00:00,2026-03-22 00:00:00,4423,Entregado
2447,2200,479,ajuste técnico de motor y árbol de levas y verificación completa.,Finalizado,2026-03-07 00:00:00,2026-02-25 00:00:00,1349,Cliente informado
2448,4073,3261,diagnóstico y reparación de embrague y pistones debido a desgaste.,Finalizado,2026-03-26 00:00:00,2026-03-28 00:00:00,4011,Entregado
2449,3465,3096,diagnóstico y reparación de diagnóstico y problema según solicitud del cliente.,Finalizado,2026-03-17 00:00:00,2026-03-18 00:00:00,5852,Entregado
2450,1664,2688,diagnóstico y reparación de pantalla y cambio color con pruebas posteriores.,Finalizado,2026-03-21 00:00:00,2026-03-24 00:00:00,535,Cliente informado
2451,695,4490,revisión completa de chequeo y inspección debido a desgaste.,Finalizado,2026-03-17 00:00:00,2026-03-07 00:00:00,1220,Cliente informado
2452,2553,1018,revisión completa de motor de arranque y motor de arranque con pruebas posteriores.,Finalizado,2026-03-04 00:00:00,2026-03-08 00:00:00,5984,Cliente informado
2453,1632,2973,servicio integral para cableado y luces debido a desgaste.,Finalizado,2026-03-15 00:00:00,2026-03-17 00:00:00,5151,Cliente informado
2454,4261,4486,inspección avanzada de radiador y amortiguadores según solicitud del cliente.,Finalizado,2026-03-07 00:00:00,2026-03-11 00:00:00,3803,Cliente informado
2455,4419,2732,inspección avanzada de chequeo y chequeo y verificación completa.,Finalizado,2026-03-20 00:00:00,2026-03-24 00:00:00,2556,Cliente informado
2456,1767,5194,servicio integral para actualización de software y estético por falla detectada.,Finalizado,2026-03-18 00:00:00,2026-03-20 00:00:00,2760,Cliente informado
2457,1160,3259,servicio integral para vinilado y modificación con pruebas posteriores.,Finalizado,2026-03-21 00:00:00,2026-03-21 00:00:00,5192,Cliente informado
2458,3979,4752,optimización del sistema polarizado y gps por falla detectada.,Finalizado,2026-03-18 00:00:00,2026-03-21 00:00:00,533,Entregado
2459,2546,4930,diagnóstico y reparación de test y diagnóstico incluyendo ajuste final.,Finalizado,2026-03-15 00:00:00,2026-03-18 00:00:00,4138,Entregado
2460,1436,2188,optimización del sistema niveles y alineación para mejorar rendimiento.,Finalizado,2026-03-01 00:00:00,2026-03-04 00:00:00,2816,Cliente informado
2461,1211,113,corrección especializada de sensores y motor de arranque debido a desgaste.,Finalizado,2026-03-19 00:00:00,2026-03-21 00:00:00,1741,Cliente informado
2462,4019,1202,diagnóstico y reparación de motor de arranque y alternador según solicitud del cliente.,Finalizado,2026-03-21 00:00:00,2026-03-21 00:00:00,2175,Entregado
2463,1929,1875,ajuste técnico de falla y ruido incluyendo ajuste final.,Finalizado,2026-03-10 00:00:00,2026-03-12 00:00:00,1023,Entregado
2464,3036,4554,mantenimiento preventivo en actualización de software y turbo debido a desgaste.,Finalizado,2026-03-28 00:00:00,2026-03-31 00:00:00,4081,Entregado
2465,4738,4912,corrección especializada de inspección y diagnóstico debido a desgaste.,Finalizado,2026-03-01 00:00:00,2026-03-03 00:00:00,4869,Cliente informado
2466,4381,2542,servicio integral para árbol de levas y bomba de agua y verificación completa.,Finalizado,2026-03-03 00:00:00,2026-03-07 00:00:00,6453,Entregado
2467,1751,513,corrección especializada de balanceo y chequeo y verificación completa.,Finalizado,2026-03-06 00:00:00,2026-03-10 00:00:00,5622,Cliente informado
2468,3401,257,corrección especializada de test y ruido y verificación completa.,Finalizado,2026-03-14 00:00:00,2026-03-18 00:00:00,5716,Entregado
2469,2535,3464,corrección especializada de velocidad y tuning para mejorar rendimiento.,Finalizado,2026-03-11 00:00:00,2026-03-11 00:00:00,3520,Cliente informado
2470,3176,2108,servicio integral para motor de arranque y alternador con pruebas posteriores.,Finalizado,2026-03-04 00:00:00,2026-03-04 00:00:00,1170,Cliente informado
2471,2737,4701,inspección avanzada de encendido y cableado según solicitud del cliente.,Finalizado,2026-03-21 00:00:00,2026-03-21 00:00:00,3517,Entregado
2472,1519,4024,instalación y calibración de chequeo y falla según solicitud del cliente.,Finalizado,2026-03-03 00:00:00,2026-03-03 00:00:00,4750,Cliente informado
2473,3977,4270,corrección especializada de falla y escaneo y verificación completa.,Finalizado,2026-03-19 00:00:00,2026-03-20 00:00:00,5941,Entregado
2474,4959,637,diagnóstico y reparación de luces y alternador para mejorar rendimiento.,Finalizado,2026-03-09 00:00:00,2026-03-10 00:00:00,2505,Entregado
2475,3368,376,ajuste técnico de falla y inspección por falla detectada.,Finalizado,2026-03-06 00:00:00,2026-03-07 00:00:00,4137,Entregado
2476,741,5222,servicio integral para embrague y radiador para mejorar rendimiento.,Finalizado,2026-03-28 00:00:00,2026-03-29 00:00:00,6291,Entregado
2477,1728,4048,revisión completa de suspensión y biela debido a desgaste.,Finalizado,2026-03-24 00:00:00,2026-03-25 00:00:00,3465,Cliente informado
2478,802,4972,corrección especializada de bujías y balanceo debido a desgaste.,Finalizado,2026-03-16 00:00:00,2026-03-17 00:00:00,4274,Cliente informado
2479,57,5056,mantenimiento preventivo en test y escaneo con pruebas posteriores.,Finalizado,2026-03-02 00:00:00,2026-03-05 00:00:00,2647,Cliente informado
2480,4041,2501,mantenimiento preventivo en ruido y falla debido a desgaste.,Finalizado,2026-03-01 00:00:00,2026-03-01 00:00:00,1884,Cliente informado
2481,3895,1935,ajuste técnico de filtro de aceite y alineación incluyendo ajuste final.,Finalizado,2026-03-05 00:00:00,2026-03-05 00:00:00,4542,Cliente informado
2482,3570,2549,mantenimiento preventivo en sistema eléctrico y centralita por falla detectada.,Finalizado,2026-03-24 00:00:00,2026-03-25 00:00:00,3027,Cliente informado
2483,4880,2346,servicio integral para falla y ruido debido a desgaste.,Finalizado,2026-03-22 00:00:00,2026-03-25 00:00:00,3929,Cliente informado
2484,4388,595,instalación y calibración de cambio color y custom por falla detectada.,En proceso,2026-03-02 00:00:00,2026-03-05 00:00:00,3223,Cliente informado
2485,3200,4867,inspección avanzada de niveles y cambio de aceite incluyendo ajuste final.,Finalizado,2026-03-11 00:00:00,2026-03-15 00:00:00,1833,Cliente informado
2486,2563,4306,corrección especializada de alineación y alineación según solicitud del cliente.,Finalizado,2026-03-24 00:00:00,2026-03-28 00:00:00,3671,Cliente informado
2487,3819,2832,inspección avanzada de sensores y encendido por falla detectada.,Finalizado,2026-03-10 00:00:00,2026-03-11 00:00:00,2206,Entregado
2488,2931,1494,inspección avanzada de motor y frenos con pruebas posteriores.,Finalizado,2026-03-11 00:00:00,2026-03-15 00:00:00,6369,Entregado
2489,4471,257,optimización del sistema eje y bomba de agua según solicitud del cliente.,Finalizado,2026-03-15 00:00:00,2026-03-17 00:00:00,5062,Entregado
2490,1323,2386,diagnóstico y reparación de transmisión y pistones y verificación completa.,Entregado,2026-03-10 00:00:00,2026-03-12 00:00:00,3733,Cliente informado
2491,394,2439,corrección especializada de alerón y calipers y verificación completa.,Finalizado,2026-03-27 00:00:00,2026-03-31 00:00:00,6301,Entregado
2492,4633,2016,optimización del sistema motor de arranque y fallo eléctrico debido a desgaste.,Finalizado,2026-03-18 00:00:00,2026-03-18 00:00:00,3346,Cliente informado
2493,1064,4365,mantenimiento preventivo en revisión general y falla debido a desgaste.,Finalizado,2026-02-28 00:00:00,2026-03-04 00:00:00,1987,Entregado
2494,3562,5193,revisión completa de actualización de software y turbo incluyendo ajuste final.,Finalizado,2026-03-24 00:00:00,2026-03-24 00:00:00,1202,Entregado
2495,1187,3819,corrección especializada de batería y batería incluyendo ajuste final.,Finalizado,2026-03-10 00:00:00,2026-03-14 00:00:00,4997,Cliente informado
2496,2122,189,instalación y calibración de frenos y distribución y verificación completa.,Finalizado,2026-03-03 00:00:00,2026-03-04 00:00:00,2008,Cliente informado
2497,1399,2837,diagnóstico y reparación de cigüeñal y suspensión por falla detectada.,Finalizado,2026-03-04 00:00:00,2026-03-04 00:00:00,3194,Cliente informado
2498,1229,2933,servicio integral para fallo eléctrico y encendido con pruebas posteriores.,Finalizado,2026-03-16 00:00:00,2026-03-18 00:00:00,3927,Entregado
2499,145,1400,revisión completa de motor de arranque y batería por falla detectada.,Finalizado,2026-03-07 00:00:00,2026-03-09 00:00:00,5270,Cliente informado
2500,1285,565,mantenimiento preventivo en sistema eléctrico y motor de arranque incluyendo ajuste final.,Finalizado,2026-03-06 00:00:00,2026-02-24 00:00:00,4140,Entregado
2501,4999,5160,diagnóstico y reparación de custom y llantas deportivas por falla detectada.,Finalizado,2026-03-13 00:00:00,2026-03-03 00:00:00,1202,Entregado
2502,3319,3817,corrección especializada de fallo eléctrico y luces incluyendo ajuste final.,Finalizado,2026-02-28 00:00:00,2026-03-02 00:00:00,4804,Cliente informado
2503,4900,560,instalación y calibración de eje y transmisión por falla detectada.,Finalizado,2026-03-06 00:00:00,2026-03-07 00:00:00,3332,Cliente informado
2504,1751,513,revisión completa de escaneo y ruido incluyendo ajuste final.,Finalizado,2026-03-06 00:00:00,2026-03-10 00:00:00,2404,Cliente informado
2505,4819,1018,optimización del sistema encendido y cableado debido a desgaste.,Finalizado,2026-03-26 00:00:00,2026-03-27 00:00:00,4204,Entregado
2506,2497,130,corrección especializada de alineación y lubricacion incluyendo ajuste final.,Finalizado,2026-02-28 00:00:00,2026-03-01 00:00:00,2191,Cliente informado
2507,977,3741,servicio integral para diferencial y cigüeñal para mejorar rendimiento.,Finalizado,2026-03-14 00:00:00,2026-03-16 00:00:00,866,Entregado
2508,2508,5186,corrección especializada de alternador y encendido debido a desgaste.,Finalizado,2026-03-11 00:00:00,2026-03-13 00:00:00,4924,Entregado
2509,2535,3464,corrección especializada de amortiguadores y motor debido a desgaste.,Finalizado,2026-03-11 00:00:00,2026-03-11 00:00:00,2778,Cliente informado
2510,3295,3651,corrección especializada de evaluación y escaneo con pruebas posteriores.,Finalizado,2026-03-19 00:00:00,2026-03-21 00:00:00,4487,Entregado
2511,3166,4505,revisión completa de sensores y centralita y verificación completa.,Finalizado,2026-03-26 00:00:00,2026-03-30 00:00:00,1447,Cliente informado
2512,1974,4930,optimización del sistema sistema eléctrico y fallo eléctrico debido a desgaste.,Finalizado,2026-03-08 00:00:00,2026-03-10 00:00:00,1105,Entregado
2513,2774,3021,optimización del sistema suspensión y amortiguadores y verificación completa.,En proceso,2026-03-24 00:00:00,2026-03-25 00:00:00,2223,Cliente informado
2514,4939,503,instalación y calibración de escaneo y chequeo según solicitud del cliente.,Finalizado,2026-03-28 00:00:00,2026-03-30 00:00:00,1428,Entregado
2515,963,1924,ajuste técnico de lubricacion y cambio de aceite con pruebas posteriores.,Finalizado,2026-02-28 00:00:00,2026-03-04 00:00:00,936,Cliente informado
2516,1134,5242,ajuste técnico de cableado y sistema eléctrico incluyendo ajuste final.,Entregado,2026-03-01 00:00:00,2026-03-04 00:00:00,1599,Entregado
2517,1962,3695,revisión completa de calipers y reprogramación debido a desgaste.,Finalizado,2026-03-07 00:00:00,2026-03-09 00:00:00,1182,Cliente informado
2518,3035,4531,revisión completa de filtro de aire y alineación debido a desgaste.,Entregado,2026-03-18 00:00:00,2026-03-18 00:00:00,5852,Cliente informado
2519,3720,3889,ajuste técnico de sensores y motor de arranque debido a desgaste.,Finalizado,2026-03-26 00:00:00,2026-03-30 00:00:00,4322,Entregado
2520,567,904,ajuste técnico de filtro de aire y revisión debido a desgaste.,Finalizado,2026-03-11 00:00:00,2026-03-15 00:00:00,2352,Cliente informado
2521,57,5056,diagnóstico y reparación de turbo y velocidad para mejorar rendimiento.,Finalizado,2026-03-02 00:00:00,2026-03-05 00:00:00,584,Cliente informado
2522,1298,1103,servicio integral para modificación y potencia debido a desgaste.,Finalizado,2026-03-23 00:00:00,2026-03-27 00:00:00,3466,Entregado
2523,3435,2139,ajuste técnico de fallo eléctrico y alternador debido a desgaste.,Finalizado,2026-03-03 00:00:00,2026-03-06 00:00:00,2023,Cliente informado
2524,2769,2169,instalación y calibración de árbol de levas y suspensión para mejorar rendimiento.,Finalizado,2026-03-11 00:00:00,2026-03-15 00:00:00,5574,Entregado
2525,2018,3369,instalación y calibración de chequeo y evaluación incluyendo ajuste final.,Finalizado,2026-03-23 00:00:00,2026-03-23 00:00:00,3785,Entregado
2526,1095,4956,ajuste técnico de cableado y luces incluyendo ajuste final.,Finalizado,2026-02-28 00:00:00,2026-03-04 00:00:00,2971,Entregado
2527,935,3572,corrección especializada de escaneo y evaluación debido a desgaste.,Finalizado,2026-03-15 00:00:00,2026-03-17 00:00:00,1539,Entregado
2528,2402,1284,corrección especializada de motor de arranque y fallo eléctrico con pruebas posteriores.,Finalizado,2026-03-06 00:00:00,2026-03-09 00:00:00,5263,Entregado
2529,4768,3741,revisión completa de alternador y fallo eléctrico y verificación completa.,Finalizado,2026-03-05 00:00:00,2026-03-07 00:00:00,3195,Cliente informado
2530,1688,396,ajuste técnico de caja de cambios y amortiguadores por falla detectada.,Finalizado,2026-03-23 00:00:00,2026-03-27 00:00:00,1306,Cliente informado
2531,935,3572,ajuste técnico de chasis y pistones con pruebas posteriores.,Finalizado,2026-03-15 00:00:00,2026-03-17 00:00:00,5354,Entregado
2532,1376,1996,inspección avanzada de diferencial y amortiguadores debido a desgaste.,Finalizado,2026-03-17 00:00:00,2026-03-18 00:00:00,6107,Entregado
2533,1323,2386,corrección especializada de luces y alternador incluyendo ajuste final.,Entregado,2026-03-10 00:00:00,2026-03-12 00:00:00,4225,Cliente informado
2534,1098,459,diagnóstico y reparación de sonido y escape deportivo y verificación completa.,Finalizado,2026-03-03 00:00:00,2026-03-06 00:00:00,4827,Cliente informado
2535,2458,2190,revisión completa de fallo eléctrico y luces y verificación completa.,Finalizado,2026-03-07 00:00:00,2026-03-08 00:00:00,1325,Cliente informado
2536,1588,606,ajuste técnico de alternador y motor de arranque debido a desgaste.,Finalizado,2026-03-20 00:00:00,2026-03-24 00:00:00,3910,Entregado
2537,4221,692,servicio integral para bomba de agua y embrague con pruebas posteriores.,Entregado,2026-03-18 00:00:00,2026-03-20 00:00:00,5009,Entregado
2538,862,811,revisión completa de chequeo y bujías con pruebas posteriores.,Finalizado,2026-03-24 00:00:00,2026-03-28 00:00:00,4861,Cliente informado
2539,1785,3695,ajuste técnico de fallo eléctrico y cableado para mejorar rendimiento.,Finalizado,2026-03-08 00:00:00,2026-03-11 00:00:00,2319,Cliente informado
2540,2125,3015,servicio integral para sensores y alternador por falla detectada.,Finalizado,2026-03-26 00:00:00,2026-03-27 00:00:00,2970,Entregado
2541,1822,4197,ajuste técnico de potencia y estético y verificación completa.,Finalizado,2026-03-26 00:00:00,2026-03-28 00:00:00,6119,Cliente informado
2542,2483,3889,inspección avanzada de evaluación y falla según solicitud del cliente.,Finalizado,2026-03-28 00:00:00,2026-03-30 00:00:00,4153,Entregado
2543,243,186,optimización del sistema inspección y inspección con pruebas posteriores.,En proceso,2026-03-02 00:00:00,2026-03-06 00:00:00,3971,Entregado
2544,2563,4306,servicio integral para turbo y turbo y verificación completa.,Finalizado,2026-03-24 00:00:00,2026-03-28 00:00:00,4772,Cliente informado
2545,4913,5187,corrección especializada de suspensión y radiador por falla detectada.,Finalizado,2026-03-04 00:00:00,2026-03-05 00:00:00,1159,Entregado
2546,4366,4693,ajuste técnico de audio y turbo por falla detectada.,Finalizado,2026-03-18 00:00:00,2026-03-19 00:00:00,5720,Entregado
2547,3191,376,instalación y calibración de luces y fallo eléctrico para mejorar rendimiento.,Finalizado,2026-03-23 00:00:00,2026-03-25 00:00:00,4094,Entregado
2548,902,5131,servicio integral para distribución y embrague con pruebas posteriores.,Finalizado,2026-03-25 00:00:00,2026-03-26 00:00:00,582,Cliente informado
2549,1323,2386,optimización del sistema chequeo y balanceo y verificación completa.,Entregado,2026-03-10 00:00:00,2026-03-12 00:00:00,617,Cliente informado
2550,893,2689,servicio integral para turbo y performance según solicitud del cliente.,Finalizado,2026-03-02 00:00:00,2026-02-20 00:00:00,4449,Entregado
2551,291,4745,mantenimiento preventivo en calipers y pintar carroceria con pruebas posteriores.,Finalizado,2026-03-09 00:00:00,2026-03-11 00:00:00,6381,Entregado
2552,1632,2973,instalación y calibración de amortiguadores y embrague por falla detectada.,Finalizado,2026-03-15 00:00:00,2026-03-17 00:00:00,5511,Cliente informado
2553,2102,3884,instalación y calibración de sensores y centralita para mejorar rendimiento.,Finalizado,2026-03-22 00:00:00,2026-03-22 00:00:00,4596,Cliente informado
2554,4406,3491,diagnóstico y reparación de sistema eléctrico y sistema eléctrico por falla detectada.,Finalizado,2026-03-04 00:00:00,2026-02-22 00:00:00,3985,Entregado
2555,3806,2037,mantenimiento preventivo en bomba de agua y suspensión por falla detectada.,Entregado,2026-03-15 00:00:00,2026-03-19 00:00:00,4087,Cliente informado
2556,4540,1036,ajuste técnico de personalización y cámara y verificación completa.,Finalizado,2026-03-12 00:00:00,2026-03-12 00:00:00,6151,Entregado
2557,3849,4433,inspección avanzada de cambio de aceite y filtro de aire incluyendo ajuste final.,Finalizado,2026-03-05 00:00:00,2026-03-05 00:00:00,553,Entregado
2558,1076,1896,corrección especializada de polarizado y pintura por falla detectada.,Finalizado,2026-03-19 00:00:00,2026-03-23 00:00:00,1291,Entregado
2559,52,2054,instalación y calibración de sensores de estacionamiento y turbo por falla detectada.,En proceso,2026-02-28 00:00:00,2026-03-03 00:00:00,4844,Entregado
2560,4409,4511,optimización del sistema caja de cambios y amortiguadores incluyendo ajuste final.,Finalizado,2026-03-01 00:00:00,2026-03-03 00:00:00,5854,Entregado
2561,2848,4660,corrección especializada de cigüeñal y carrocería con pruebas posteriores.,Finalizado,2026-03-22 00:00:00,2026-03-25 00:00:00,4194,Cliente informado
2562,695,4490,instalación y calibración de lubricacion y filtro de aceite con pruebas posteriores.,Finalizado,2026-03-17 00:00:00,2026-03-07 00:00:00,1131,Cliente informado
2563,783,192,ajuste técnico de fibra de carbono y pantalla según solicitud del cliente.,Finalizado,2026-03-01 00:00:00,2026-03-04 00:00:00,536,Cliente informado
2564,597,2954,ajuste técnico de luces y alternador según solicitud del cliente.,Finalizado,2026-03-25 00:00:00,2026-03-27 00:00:00,4851,Cliente informado
2565,4573,132,mantenimiento preventivo en carrocería y árbol de levas por falla detectada.,Finalizado,2026-03-09 00:00:00,2026-03-12 00:00:00,2512,Cliente informado
2566,2546,4930,corrección especializada de árbol de levas y bomba de agua y verificación completa.,Finalizado,2026-03-15 00:00:00,2026-03-18 00:00:00,3797,Entregado
2567,315,3035,servicio integral para centralita y cableado para mejorar rendimiento.,Finalizado,2026-03-07 00:00:00,2026-03-10 00:00:00,2754,Entregado
2568,3001,746,ajuste técnico de cableado y sistema eléctrico por falla detectada.,En proceso,2026-03-02 00:00:00,2026-03-03 00:00:00,5525,Cliente informado
2569,160,5177,optimización del sistema alineación y filtro de aceite según solicitud del cliente.,En proceso,2026-03-18 00:00:00,2026-03-18 00:00:00,3081,Entregado
2570,4655,4571,servicio integral para centralita y centralita con pruebas posteriores.,Finalizado,2026-03-27 00:00:00,2026-03-27 00:00:00,5097,Cliente informado
2571,3124,1096,revisión completa de batería y centralita por falla detectada.,Finalizado,2026-03-11 00:00:00,2026-03-12 00:00:00,3581,Entregado
2572,1187,3819,servicio integral para balanceo y bujías para mejorar rendimiento.,Finalizado,2026-03-10 00:00:00,2026-03-14 00:00:00,1438,Cliente informado
2573,4165,3769,instalación y calibración de balanceo y balanceo incluyendo ajuste final.,Finalizado,2026-03-14 00:00:00,2026-03-17 00:00:00,5272,Cliente informado
2574,4381,3015,revisión completa de fibra de carbono y tuning y verificación completa.,Finalizado,2026-03-23 00:00:00,2026-03-25 00:00:00,1779,Cliente informado
2575,1400,656,revisión completa de batería y fallo eléctrico para mejorar rendimiento.,En proceso,2026-03-08 00:00:00,2026-03-08 00:00:00,5341,Cliente informado
2576,1268,5173,ajuste técnico de falla y test por falla detectada.,Entregado,2026-03-24 00:00:00,2026-03-27 00:00:00,561,Cliente informado
2577,96,914,diagnóstico y reparación de gps y pantalla debido a desgaste.,Finalizado,2026-03-04 00:00:00,2026-03-08 00:00:00,6478,Entregado
2578,1681,1471,instalación y calibración de sensores y alternador debido a desgaste.,Finalizado,2026-03-26 00:00:00,2026-03-26 00:00:00,5538,Entregado
2579,3035,4531,revisión completa de sistema eléctrico y cableado incluyendo ajuste final.,Entregado,2026-03-18 00:00:00,2026-03-18 00:00:00,1091,Cliente informado
2580,28,3267,diagnóstico y reparación de bomba de agua y carrocería y verificación completa.,Finalizado,2026-03-15 00:00:00,2026-03-18 00:00:00,6345,Cliente informado
2581,144,2369,inspección avanzada de sonido y pantalla por falla detectada.,Finalizado,2026-03-21 00:00:00,2026-03-25 00:00:00,2819,Cliente informado
2582,357,301,servicio integral para ruido y evaluación con pruebas posteriores.,Finalizado,2026-03-24 00:00:00,2026-03-24 00:00:00,2275,Cliente informado
2583,3513,2464,servicio integral para motor de arranque y luces para mejorar rendimiento.,Finalizado,2026-03-02 00:00:00,2026-03-05 00:00:00,5374,Cliente informado
2584,2314,1378,ajuste técnico de cámara y cromado incluyendo ajuste final.,Finalizado,2026-03-08 00:00:00,2026-03-09 00:00:00,3326,Cliente informado
2585,4900,560,instalación y calibración de lubricacion y filtro de aceite debido a desgaste.,Finalizado,2026-03-06 00:00:00,2026-03-07 00:00:00,2527,Cliente informado
2586,4655,4571,mantenimiento preventivo en eje y radiador debido a desgaste.,Finalizado,2026-03-27 00:00:00,2026-03-27 00:00:00,2377,Cliente informado
2587,3720,3889,revisión completa de test y chequeo con pruebas posteriores.,Finalizado,2026-03-26 00:00:00,2026-03-30 00:00:00,2419,Entregado
2588,4271,3014,optimización del sistema chip y sensores de estacionamiento por falla detectada.,Finalizado,2026-03-26 00:00:00,2026-03-28 00:00:00,1784,Cliente informado
2589,2411,4957,mantenimiento preventivo en test y diagnóstico para mejorar rendimiento.,Finalizado,2026-03-20 00:00:00,2026-03-23 00:00:00,3493,Cliente informado
2590,4844,1735,revisión completa de fallo eléctrico y alternador debido a desgaste.,Finalizado,2026-03-24 00:00:00,2026-03-27 00:00:00,3432,Entregado
2591,4155,3460,ajuste técnico de cámara y chip incluyendo ajuste final.,Finalizado,2026-03-11 00:00:00,2026-03-11 00:00:00,1186,Cliente informado
2592,1920,4634,ajuste técnico de niveles y lubricacion con pruebas posteriores.,Finalizado,2026-03-10 00:00:00,2026-03-14 00:00:00,4722,Entregado
2593,844,4307,ajuste técnico de transmisión y motor por falla detectada.,Finalizado,2026-03-02 00:00:00,2026-03-06 00:00:00,5542,Cliente informado
2594,1919,1331,revisión completa de sensores y centralita y verificación completa.,Finalizado,2026-03-26 00:00:00,2026-03-30 00:00:00,5530,Entregado
2595,3615,2346,inspección avanzada de escape deportivo y frenos deportivos con pruebas posteriores.,Finalizado,2026-03-20 00:00:00,2026-03-21 00:00:00,4473,Entregado
2596,3813,4236,instalación y calibración de chequeo y falla para mejorar rendimiento.,Finalizado,2026-03-02 00:00:00,2026-02-20 00:00:00,1404,Entregado
2597,3642,3490,mantenimiento preventivo en chequeo y revisión debido a desgaste.,Finalizado,2026-03-20 00:00:00,2026-03-24 00:00:00,5497,Entregado
2598,863,2202,instalación y calibración de centralita y cableado por falla detectada.,En proceso,2026-03-22 00:00:00,2026-03-24 00:00:00,4058,Cliente informado
2599,3813,4236,servicio integral para embrague y bomba de agua por falla detectada.,Finalizado,2026-03-02 00:00:00,2026-02-20 00:00:00,1835,Entregado
2600,4483,2879,inspección avanzada de reprogramación y cámara debido a desgaste.,Finalizado,2026-03-24 00:00:00,2026-03-25 00:00:00,1054,Cliente informado
