IdReparacion,IdMoto,IdUsuario,Descripcion,Estado,FechaInicio,FechaFin,Total,Fase
3571,1795,4343,mantenimiento preventivo en calipers y pantalla y verificación completa.,Finalizado,2026-03-29 00:00:00,2026-03-31 00:00:00,4473,Cliente informado
3572,4729,2714,inspección avanzada de centralita y motor de arranque incluyendo ajuste final.,Finalizado,2026-03-08 00:00:00,2026-03-10 00:00:00,2693,Cliente informado
3573,3379,1932,optimización del sistema motor y árbol de levas incluyendo ajuste final.,Finalizado,2026-03-27 00:00:00,2026-03-30 00:00:00,3990,Cliente informado
3574,1812,2830,instalación y calibración de falla y revisión general por falla detectada.,Finalizado,2026-03-03 00:00:00,2026-03-03 00:00:00,3785,Cliente informado
3575,4106,2717,corrección especializada de centralita y cableado incluyendo ajuste final.,Finalizado,2026-03-21 00:00:00,2026-03-22 00:00:00,6355,Entregado
3576,2670,60,inspección avanzada de filtro de aire y lubricacion incluyendo ajuste final.,Finalizado,2026-03-20 00:00:00,2026-03-20 00:00:00,5677,Cliente informado
3577,551,969,corrección especializada de revisión y filtro de aire con pruebas posteriores.,Finalizado,2026-03-18 00:00:00,2026-03-08 00:00:00,4347,Cliente informado
3578,4522,4978,servicio integral para pintura y pintar carroceria según solicitud del cliente.,Finalizado,2026-03-11 00:00:00,2026-03-11 00:00:00,3736,Entregado
3579,2263,3844,inspección avanzada de filtro de aire y bujías para mejorar rendimiento.,Finalizado,2026-03-23 00:00:00,2026-03-23 00:00:00,6483,Entregado
3580,3075,3364,servicio integral para cambio de aceite y balanceo y verificación completa.,Finalizado,2026-03-13 00:00:00,2026-03-17 00:00:00,3070,Cliente informado
3581,3185,4552,corrección especializada de personalización y cromado para mejorar rendimiento.,Finalizado,2026-03-22 00:00:00,2026-03-26 00:00:00,1669,Entregado
3582,1066,2938,ajuste técnico de revisión general y revisión general debido a desgaste.,Finalizado,2026-03-27 00:00:00,2026-03-27 00:00:00,1143,Entregado
3583,632,3003,inspección avanzada de diagnóstico y chequeo con pruebas posteriores.,Finalizado,2026-03-13 00:00:00,2026-03-14 00:00:00,5490,Cliente informado
3584,1066,2938,servicio integral para biela y motor según solicitud del cliente.,Finalizado,2026-03-27 00:00:00,2026-03-27 00:00:00,507,Entregado
3585,4804,3937,diagnóstico y reparación de alineación y bujías incluyendo ajuste final.,Finalizado,2026-03-08 00:00:00,2026-03-09 00:00:00,6312,Cliente informado
3586,1862,3441,optimización del sistema problema y chequeo para mejorar rendimiento.,Finalizado,2026-03-28 00:00:00,2026-03-30 00:00:00,1359,Cliente informado
3587,802,4732,optimización del sistema velocidad y calipers por falla detectada.,Finalizado,2026-03-09 00:00:00,2026-03-13 00:00:00,3016,Cliente informado
3588,1399,2837,corrección especializada de calipers y cambio color incluyendo ajuste final.,Finalizado,2026-03-04 00:00:00,2026-03-04 00:00:00,6465,Cliente informado
3589,4271,233,inspección avanzada de bujías y niveles para mejorar rendimiento.,Finalizado,2026-03-12 00:00:00,2026-03-14 00:00:00,5013,Cliente informado
3590,182,134,ajuste técnico de velocidad y cámara según solicitud del cliente.,Finalizado,2026-03-15 00:00:00,2026-03-19 00:00:00,5609,Entregado
3591,2004,936,instalación y calibración de cableado y sistema eléctrico incluyendo ajuste final.,Finalizado,2026-03-14 00:00:00,2026-03-14 00:00:00,3297,Entregado
3592,802,4972,revisión completa de reprogramación y potencia por falla detectada.,Finalizado,2026-03-16 00:00:00,2026-03-17 00:00:00,1428,Cliente informado
3593,4666,3999,ajuste técnico de lubricacion y revisión con pruebas posteriores.,Finalizado,2026-03-14 00:00:00,2026-03-16 00:00:00,1209,Cliente informado
3594,979,1369,ajuste técnico de sensores y alternador debido a desgaste.,Finalizado,2026-03-18 00:00:00,2026-03-19 00:00:00,6043,Entregado
3595,325,1695,inspección avanzada de balanceo y chequeo para mejorar rendimiento.,Finalizado,2026-03-09 00:00:00,2026-02-27 00:00:00,5945,Entregado
3596,1112,1234,diagnóstico y reparación de centralita y sensores según solicitud del cliente.,Finalizado,2026-03-15 00:00:00,2026-03-17 00:00:00,4121,Cliente informado
3597,594,3326,ajuste técnico de cambio de aceite y bujías para mejorar rendimiento.,Finalizado,2026-03-20 00:00:00,2026-03-24 00:00:00,1960,Cliente informado
3598,3887,1284,inspección avanzada de sensores de estacionamiento y vinilado incluyendo ajuste final.,Finalizado,2026-02-28 00:00:00,2026-03-02 00:00:00,4533,Entregado
3599,2873,2693,instalación y calibración de test y chequeo por falla detectada.,Finalizado,2026-03-02 00:00:00,2026-03-05 00:00:00,5767,Cliente informado
3600,4715,2721,inspección avanzada de balanceo y bujías según solicitud del cliente.,Finalizado,2026-03-01 00:00:00,2026-03-01 00:00:00,780,Cliente informado
3601,2873,2693,revisión completa de actualización de software y fibra de carbono para mejorar rendimiento.,Finalizado,2026-03-02 00:00:00,2026-03-05 00:00:00,4315,Cliente informado
3602,3615,2346,optimización del sistema radiador y amortiguadores para mejorar rendimiento.,Finalizado,2026-03-20 00:00:00,2026-03-21 00:00:00,1748,Entregado
3603,4450,715,instalación y calibración de reprogramación y chip según solicitud del cliente.,Finalizado,2026-03-02 00:00:00,2026-03-03 00:00:00,3854,Entregado
3604,3962,1533,corrección especializada de culata y chasis incluyendo ajuste final.,Finalizado,2026-03-29 00:00:00,2026-03-31 00:00:00,6370,Cliente informado
3605,3745,1361,revisión completa de ruido y revisión general incluyendo ajuste final.,Finalizado,2026-03-18 00:00:00,2026-03-21 00:00:00,2248,Entregado
3606,3909,2476,instalación y calibración de carrocería y chasis para mejorar rendimiento.,Finalizado,2026-02-28 00:00:00,2026-03-01 00:00:00,1166,Entregado
3607,552,1625,corrección especializada de vinilado y estético según solicitud del cliente.,Finalizado,2026-03-24 00:00:00,2026-03-26 00:00:00,2550,Cliente informado
3608,4633,1876,instalación y calibración de suspensión y biela incluyendo ajuste final.,Finalizado,2026-03-23 00:00:00,2026-03-24 00:00:00,3471,Cliente informado
3609,3642,3490,instalación y calibración de inspección y inspección y verificación completa.,Finalizado,2026-03-20 00:00:00,2026-03-24 00:00:00,5315,Entregado
3610,3975,4398,ajuste técnico de actualización de software y tuning incluyendo ajuste final.,Finalizado,2026-03-07 00:00:00,2026-03-11 00:00:00,5453,Cliente informado
3611,4419,2732,ajuste técnico de audio y pintar carroceria incluyendo ajuste final.,Finalizado,2026-03-20 00:00:00,2026-03-24 00:00:00,4384,Cliente informado
3612,4819,1018,corrección especializada de radiador y pistones incluyendo ajuste final.,Finalizado,2026-03-26 00:00:00,2026-03-27 00:00:00,4372,Entregado
3613,4902,4493,instalación y calibración de encendido y batería para mejorar rendimiento.,Finalizado,2026-03-06 00:00:00,2026-03-10 00:00:00,3422,Entregado
3614,551,969,revisión completa de vinilado y turbo con pruebas posteriores.,Finalizado,2026-03-18 00:00:00,2026-03-08 00:00:00,5153,Cliente informado
3615,1401,2283,diagnóstico y reparación de estético y cámara según solicitud del cliente.,Finalizado,2026-03-13 00:00:00,2026-03-15 00:00:00,1453,Entregado
3616,1519,4024,corrección especializada de gps y cromado con pruebas posteriores.,Finalizado,2026-03-03 00:00:00,2026-03-03 00:00:00,518,Cliente informado
3617,2677,3090,optimización del sistema pistones y transmisión debido a desgaste.,Finalizado,2026-03-17 00:00:00,2026-03-17 00:00:00,2630,Cliente informado
3618,4306,1278,mantenimiento preventivo en frenos y distribución y verificación completa.,Finalizado,2026-03-03 00:00:00,2026-03-07 00:00:00,2615,Entregado
3619,4927,60,ajuste técnico de pintura y tuning con pruebas posteriores.,Finalizado,2026-02-28 00:00:00,2026-02-28 00:00:00,3074,Cliente informado
3620,1527,4118,revisión completa de caja de cambios y bomba de agua debido a desgaste.,Finalizado,2026-03-06 00:00:00,2026-03-07 00:00:00,5460,Entregado
3621,2449,443,revisión completa de lubricacion y lubricacion debido a desgaste.,Finalizado,2026-03-17 00:00:00,2026-03-17 00:00:00,4196,Entregado
3622,1901,3769,instalación y calibración de sensores de estacionamiento y calipers con pruebas posteriores.,Finalizado,2026-03-25 00:00:00,2026-03-15 00:00:00,3964,Entregado
3623,756,3657,mantenimiento preventivo en alineación y alineación para mejorar rendimiento.,Finalizado,2026-03-07 00:00:00,2026-03-09 00:00:00,2084,Cliente informado
3624,1664,2688,optimización del sistema caja de cambios y dirección con pruebas posteriores.,Finalizado,2026-03-21 00:00:00,2026-03-24 00:00:00,678,Cliente informado
3625,1869,68,ajuste técnico de biela y pistones según solicitud del cliente.,Finalizado,2026-03-14 00:00:00,2026-03-14 00:00:00,6312,Cliente informado
3626,838,3395,revisión completa de falla y escaneo según solicitud del cliente.,Finalizado,2026-03-16 00:00:00,2026-03-17 00:00:00,1223,Cliente informado
3627,1169,708,inspección avanzada de chip y audio para mejorar rendimiento.,Finalizado,2026-03-14 00:00:00,2026-03-18 00:00:00,4043,Entregado
3628,800,5194,corrección especializada de eje y distribución debido a desgaste.,Finalizado,2026-03-01 00:00:00,2026-03-05 00:00:00,1368,Entregado
3629,135,3855,diagnóstico y reparación de cambio de aceite y filtro de aceite según solicitud del cliente.,Finalizado,2026-03-19 00:00:00,2026-03-09 00:00:00,3232,Entregado
3630,4409,4511,corrección especializada de carrocería y suspensión debido a desgaste.,Finalizado,2026-03-01 00:00:00,2026-03-03 00:00:00,1298,Entregado
3631,2122,189,servicio integral para batería y cableado debido a desgaste.,Finalizado,2026-03-03 00:00:00,2026-03-04 00:00:00,4474,Cliente informado
3632,2860,5193,mantenimiento preventivo en revisión y chequeo por falla detectada.,Finalizado,2026-03-15 00:00:00,2026-03-15 00:00:00,6112,Cliente informado
3633,2895,4672,ajuste técnico de revisión general y revisión general según solicitud del cliente.,Finalizado,2026-03-12 00:00:00,2026-03-14 00:00:00,5058,Entregado
3634,2968,936,servicio integral para falla y problema por falla detectada.,Finalizado,2026-03-12 00:00:00,2026-03-13 00:00:00,756,Entregado
3635,4708,3694,optimización del sistema ruido y falla por falla detectada.,Finalizado,2026-03-13 00:00:00,2026-03-16 00:00:00,5859,Cliente informado
3636,1756,1635,servicio integral para test y inspección con pruebas posteriores.,Finalizado,2026-03-14 00:00:00,2026-03-17 00:00:00,6168,Entregado
3637,4085,3309,revisión completa de centralita y cableado con pruebas posteriores.,Finalizado,2026-03-27 00:00:00,2026-03-31 00:00:00,762,Entregado
3638,1400,656,corrección especializada de revisión y cambio de aceite y verificación completa.,En proceso,2026-03-08 00:00:00,2026-03-08 00:00:00,1904,Cliente informado
3639,829,3315,inspección avanzada de eje y embrague y verificación completa.,Finalizado,2026-03-26 00:00:00,2026-03-26 00:00:00,4942,Cliente informado
3640,4137,1039,inspección avanzada de sensores y alternador según solicitud del cliente.,Finalizado,2026-03-23 00:00:00,2026-03-25 00:00:00,1262,Cliente informado
3641,4780,5251,revisión completa de bujías y lubricacion con pruebas posteriores.,Finalizado,2026-03-17 00:00:00,2026-03-20 00:00:00,5254,Cliente informado
3642,282,1951,revisión completa de evaluación y test según solicitud del cliente.,Finalizado,2026-03-25 00:00:00,2026-03-15 00:00:00,3237,Entregado
3643,3759,2943,optimización del sistema cambio color y custom con pruebas posteriores.,Finalizado,2026-03-27 00:00:00,2026-03-31 00:00:00,5662,Cliente informado
3644,4489,3051,corrección especializada de embrague y carrocería y verificación completa.,Finalizado,2026-03-15 00:00:00,2026-03-17 00:00:00,3450,Entregado
3645,4393,2682,optimización del sistema alineación y alineación con pruebas posteriores.,Finalizado,2026-03-08 00:00:00,2026-03-09 00:00:00,5700,Cliente informado
3646,3435,2139,ajuste técnico de cableado y sistema eléctrico debido a desgaste.,Finalizado,2026-03-03 00:00:00,2026-03-06 00:00:00,1472,Cliente informado
3647,3585,559,optimización del sistema diferencial y cigüeñal por falla detectada.,Finalizado,2026-03-06 00:00:00,2026-03-07 00:00:00,2779,Entregado
3648,3652,4244,inspección avanzada de suspensión y frenos para mejorar rendimiento.,Finalizado,2026-03-02 00:00:00,2026-03-02 00:00:00,5985,Entregado
3649,2659,4236,inspección avanzada de transmisión y embrague debido a desgaste.,Finalizado,2026-03-28 00:00:00,2026-04-01 00:00:00,3001,Cliente informado
3650,145,1400,revisión completa de filtro de aire y alineación debido a desgaste.,Finalizado,2026-03-07 00:00:00,2026-03-09 00:00:00,2553,Cliente informado
3651,3657,4196,diagnóstico y reparación de motor y biela por falla detectada.,Finalizado,2026-03-14 00:00:00,2026-03-17 00:00:00,6413,Cliente informado
3652,2481,2099,corrección especializada de cableado y sensores por falla detectada.,Finalizado,2026-03-07 00:00:00,2026-03-08 00:00:00,5354,Entregado
3653,4044,1153,instalación y calibración de sistema eléctrico y luces según solicitud del cliente.,Finalizado,2026-03-21 00:00:00,2026-03-25 00:00:00,4211,Cliente informado
3654,4980,2673,revisión completa de potencia y pantalla según solicitud del cliente.,Finalizado,2026-02-28 00:00:00,2026-03-04 00:00:00,1708,Entregado
3655,182,134,revisión completa de tuning y pantalla debido a desgaste.,Finalizado,2026-03-15 00:00:00,2026-03-19 00:00:00,2054,Entregado
3656,3211,2692,ajuste técnico de batería y batería para mejorar rendimiento.,Finalizado,2026-03-05 00:00:00,2026-03-05 00:00:00,5083,Entregado
3657,4406,3491,mantenimiento preventivo en personalización y pintar carroceria para mejorar rendimiento.,Finalizado,2026-03-04 00:00:00,2026-02-22 00:00:00,1741,Entregado
3658,3243,3177,corrección especializada de problema y inspección por falla detectada.,Finalizado,2026-03-11 00:00:00,2026-03-12 00:00:00,3725,Entregado
3659,3510,3426,mantenimiento preventivo en cigüeñal y cigüeñal según solicitud del cliente.,Finalizado,2026-03-18 00:00:00,2026-03-19 00:00:00,3720,Cliente informado
3660,1371,1253,corrección especializada de cableado y luces incluyendo ajuste final.,Finalizado,2026-03-24 00:00:00,2026-03-25 00:00:00,5268,Cliente informado
3661,4445,1331,revisión completa de niveles y revisión debido a desgaste.,Finalizado,2026-03-04 00:00:00,2026-03-07 00:00:00,1284,Entregado
3662,3786,493,mantenimiento preventivo en cableado y fallo eléctrico por falla detectada.,Finalizado,2026-03-12 00:00:00,2026-03-13 00:00:00,829,Cliente informado
3663,1767,2420,diagnóstico y reparación de diferencial y distribución para mejorar rendimiento.,Finalizado,2026-03-22 00:00:00,2026-03-23 00:00:00,2036,Entregado
3664,3395,346,instalación y calibración de test y diagnóstico para mejorar rendimiento.,Finalizado,2026-03-09 00:00:00,2026-03-11 00:00:00,1064,Entregado
3665,3989,2360,servicio integral para suspensión y transmisión con pruebas posteriores.,Finalizado,2026-03-12 00:00:00,2026-03-13 00:00:00,682,Cliente informado
3666,717,4250,corrección especializada de frenos y cigüeñal según solicitud del cliente.,Finalizado,2026-03-04 00:00:00,2026-03-05 00:00:00,5353,Cliente informado
3667,3858,27,ajuste técnico de cigüeñal y eje y verificación completa.,Finalizado,2026-03-23 00:00:00,2026-03-25 00:00:00,3981,Cliente informado
3668,2279,3464,mantenimiento preventivo en alineación y filtro de aceite incluyendo ajuste final.,Finalizado,2026-03-06 00:00:00,2026-03-08 00:00:00,1966,Cliente informado
3669,4381,2542,servicio integral para encendido y luces con pruebas posteriores.,Finalizado,2026-03-03 00:00:00,2026-03-07 00:00:00,600,Entregado
3670,3211,2692,ajuste técnico de polarizado y escape deportivo debido a desgaste.,Finalizado,2026-03-05 00:00:00,2026-03-05 00:00:00,537,Entregado
3671,1862,3441,mantenimiento preventivo en evaluación y evaluación con pruebas posteriores.,Finalizado,2026-03-28 00:00:00,2026-03-30 00:00:00,5991,Cliente informado
3672,387,2342,inspección avanzada de evaluación y falla según solicitud del cliente.,Finalizado,2026-03-14 00:00:00,2026-03-15 00:00:00,3048,Entregado
3673,1046,2124,optimización del sistema chequeo y escaneo debido a desgaste.,Finalizado,2026-03-23 00:00:00,2026-03-24 00:00:00,3632,Cliente informado
3674,1809,1018,inspección avanzada de sensores y sistema eléctrico para mejorar rendimiento.,Finalizado,2026-03-03 00:00:00,2026-03-03 00:00:00,1718,Entregado
3675,4276,4136,corrección especializada de chequeo y escaneo por falla detectada.,Finalizado,2026-03-03 00:00:00,2026-03-05 00:00:00,1732,Cliente informado
3676,845,4467,revisión completa de lubricacion y alineación debido a desgaste.,Finalizado,2026-03-05 00:00:00,2026-03-05 00:00:00,5889,Entregado
3677,4483,2879,corrección especializada de lubricacion y balanceo con pruebas posteriores.,Finalizado,2026-03-24 00:00:00,2026-03-25 00:00:00,2177,Cliente informado
3678,2516,4849,corrección especializada de culata y pistones por falla detectada.,Finalizado,2026-03-05 00:00:00,2026-03-05 00:00:00,4625,Entregado
3679,3275,788,ajuste técnico de diagnóstico y ruido por falla detectada.,Finalizado,2026-03-06 00:00:00,2026-03-10 00:00:00,2592,Cliente informado
3680,4017,3408,instalación y calibración de fallo eléctrico y fallo eléctrico incluyendo ajuste final.,Finalizado,2026-03-23 00:00:00,2026-03-23 00:00:00,6499,Cliente informado
3681,213,363,optimización del sistema carrocería y caja de cambios debido a desgaste.,Finalizado,2026-03-21 00:00:00,2026-03-21 00:00:00,5070,Entregado
3682,3282,4548,instalación y calibración de velocidad y kit aerodinámico según solicitud del cliente.,Finalizado,2026-03-24 00:00:00,2026-03-14 00:00:00,1375,Cliente informado
3683,3672,2900,corrección especializada de chequeo y test y verificación completa.,Finalizado,2026-03-17 00:00:00,2026-03-20 00:00:00,5267,Cliente informado
3684,2226,1021,servicio integral para frenos deportivos y custom con pruebas posteriores.,Finalizado,2026-03-25 00:00:00,2026-03-25 00:00:00,647,Entregado
3685,2411,4957,servicio integral para diagnóstico y problema para mejorar rendimiento.,Finalizado,2026-03-20 00:00:00,2026-03-23 00:00:00,1528,Cliente informado
3686,3304,1765,inspección avanzada de problema y inspección según solicitud del cliente.,Finalizado,2026-03-24 00:00:00,2026-03-24 00:00:00,1328,Cliente informado
3687,4860,2387,instalación y calibración de cambio de aceite y chequeo debido a desgaste.,Finalizado,2026-03-20 00:00:00,2026-03-21 00:00:00,5404,Cliente informado
3688,640,350,mantenimiento preventivo en tuning y pantalla por falla detectada.,Finalizado,2026-03-20 00:00:00,2026-03-24 00:00:00,1760,Entregado
3689,1046,2124,optimización del sistema cableado y centralita según solicitud del cliente.,Finalizado,2026-03-23 00:00:00,2026-03-24 00:00:00,5414,Cliente informado
3690,2928,2742,inspección avanzada de niveles y filtro de aceite incluyendo ajuste final.,Finalizado,2026-03-22 00:00:00,2026-03-26 00:00:00,641,Cliente informado
3691,1870,4841,servicio integral para filtro de aceite y balanceo y verificación completa.,Finalizado,2026-03-27 00:00:00,2026-03-28 00:00:00,5211,Cliente informado
3692,243,3276,revisión completa de culata y culata con pruebas posteriores.,Finalizado,2026-03-06 00:00:00,2026-03-10 00:00:00,1057,Cliente informado
3693,2144,4165,servicio integral para filtro de aceite y alineación con pruebas posteriores.,Finalizado,2026-03-08 00:00:00,2026-03-09 00:00:00,4896,Entregado
3694,3541,2237,optimización del sistema distribución y suspensión por falla detectada.,Finalizado,2026-03-13 00:00:00,2026-03-17 00:00:00,1669,Cliente informado
3695,1929,1875,mantenimiento preventivo en bujías y revisión incluyendo ajuste final.,Finalizado,2026-03-10 00:00:00,2026-03-12 00:00:00,4631,Entregado
3696,2146,3659,optimización del sistema chequeo y falla incluyendo ajuste final.,Finalizado,2026-03-05 00:00:00,2026-03-06 00:00:00,4915,Entregado
3697,3304,1765,mantenimiento preventivo en encendido y alternador con pruebas posteriores.,Finalizado,2026-03-24 00:00:00,2026-03-24 00:00:00,4984,Cliente informado
3698,4165,3769,inspección avanzada de chequeo y cambio de aceite y verificación completa.,Finalizado,2026-03-14 00:00:00,2026-03-17 00:00:00,1677,Cliente informado
3699,4017,3408,ajuste técnico de filtro de aceite y filtro de aire debido a desgaste.,Finalizado,2026-03-23 00:00:00,2026-03-23 00:00:00,5135,Cliente informado
3700,696,537,ajuste técnico de chequeo y evaluación por falla detectada.,Finalizado,2026-03-27 00:00:00,2026-03-28 00:00:00,4855,Cliente informado
3701,485,1384,inspección avanzada de pantalla y escape deportivo por falla detectada.,Finalizado,2026-03-26 00:00:00,2026-03-30 00:00:00,5733,Entregado
3702,2200,479,ajuste técnico de fallo eléctrico y motor de arranque con pruebas posteriores.,Finalizado,2026-03-07 00:00:00,2026-02-25 00:00:00,1427,Cliente informado
3703,1891,2066,inspección avanzada de chasis y embrague debido a desgaste.,Finalizado,2026-03-18 00:00:00,2026-03-18 00:00:00,5049,Cliente informado
3704,2791,4963,mantenimiento preventivo en niveles y revisión según solicitud del cliente.,Finalizado,2026-03-10 00:00:00,2026-03-10 00:00:00,5651,Entregado
3705,4445,1331,mantenimiento preventivo en centralita y alternador con pruebas posteriores.,Finalizado,2026-03-04 00:00:00,2026-03-07 00:00:00,3268,Entregado
3706,2922,599,corrección especializada de revisión y chequeo por falla detectada.,Finalizado,2026-03-14 00:00:00,2026-03-04 00:00:00,1492,Cliente informado
3707,2268,104,optimización del sistema luces y encendido para mejorar rendimiento.,Finalizado,2026-03-03 00:00:00,2026-03-07 00:00:00,5267,Entregado
3708,299,58,mantenimiento preventivo en fibra de carbono y modificación debido a desgaste.,Finalizado,2026-03-03 00:00:00,2026-03-05 00:00:00,5922,Entregado
3709,4988,4827,servicio integral para lubricacion y lubricacion debido a desgaste.,Finalizado,2026-03-15 00:00:00,2026-03-19 00:00:00,1339,Entregado
3710,4120,995,revisión completa de gps y modificación por falla detectada.,Finalizado,2026-03-18 00:00:00,2026-03-20 00:00:00,2756,Cliente informado
3711,3635,4633,inspección avanzada de revisión general y escaneo con pruebas posteriores.,Finalizado,2026-03-01 00:00:00,2026-03-04 00:00:00,4992,Cliente informado
3712,4237,5070,instalación y calibración de dirección y amortiguadores debido a desgaste.,Finalizado,2026-03-12 00:00:00,2026-03-12 00:00:00,1884,Cliente informado
3713,2121,4930,revisión completa de chequeo y balanceo y verificación completa.,Finalizado,2026-03-05 00:00:00,2026-03-06 00:00:00,1608,Entregado
3714,3188,4791,instalación y calibración de inspección y evaluación y verificación completa.,Finalizado,2026-03-21 00:00:00,2026-03-25 00:00:00,5339,Cliente informado
3715,1336,3821,optimización del sistema encendido y fallo eléctrico y verificación completa.,Finalizado,2026-03-20 00:00:00,2026-03-24 00:00:00,1601,Entregado
3716,1217,2603,corrección especializada de actualización de software y performance incluyendo ajuste final.,Finalizado,2026-03-20 00:00:00,2026-03-22 00:00:00,1097,Cliente informado
3717,756,3657,mantenimiento preventivo en embrague y pistones y verificación completa.,Finalizado,2026-03-07 00:00:00,2026-03-09 00:00:00,5285,Cliente informado
3718,3344,852,revisión completa de balanceo y revisión según solicitud del cliente.,Finalizado,2026-02-28 00:00:00,2026-03-04 00:00:00,3473,Entregado
3719,2696,773,corrección especializada de fallo eléctrico y cableado incluyendo ajuste final.,Finalizado,2026-03-19 00:00:00,2026-03-22 00:00:00,5188,Entregado
3720,4991,3490,mantenimiento preventivo en fallo eléctrico y motor de arranque con pruebas posteriores.,Finalizado,2026-03-12 00:00:00,2026-03-16 00:00:00,4015,Entregado
3721,2795,3364,ajuste técnico de sensores de estacionamiento y alerón por falla detectada.,Entregado,2026-03-09 00:00:00,2026-03-10 00:00:00,5443,Cliente informado
3722,3806,2037,mantenimiento preventivo en pintar carroceria y actualización de software por falla detectada.,Entregado,2026-03-15 00:00:00,2026-03-19 00:00:00,3038,Cliente informado
3723,4913,5187,mantenimiento preventivo en polarizado y cambio color para mejorar rendimiento.,Finalizado,2026-03-04 00:00:00,2026-03-05 00:00:00,2343,Entregado
3724,4652,4435,corrección especializada de dirección y chasis incluyendo ajuste final.,Finalizado,2026-03-25 00:00:00,2026-03-27 00:00:00,3783,Entregado
3725,2911,3616,optimización del sistema bujías y bujías y verificación completa.,Finalizado,2026-03-01 00:00:00,2026-03-02 00:00:00,5150,Entregado
3726,2071,3721,instalación y calibración de centralita y alternador por falla detectada.,Finalizado,2026-03-04 00:00:00,2026-03-05 00:00:00,4696,Cliente informado
3727,2004,936,diagnóstico y reparación de revisión general y evaluación por falla detectada.,Finalizado,2026-03-14 00:00:00,2026-03-14 00:00:00,2008,Entregado
3728,3363,536,ajuste técnico de ruido y escaneo con pruebas posteriores.,Finalizado,2026-03-29 00:00:00,2026-03-31 00:00:00,5900,Cliente informado
3729,594,3326,optimización del sistema alineación y revisión para mejorar rendimiento.,Finalizado,2026-03-20 00:00:00,2026-03-24 00:00:00,4682,Cliente informado
3730,3293,1184,inspección avanzada de test y chequeo debido a desgaste.,Finalizado,2026-03-14 00:00:00,2026-03-15 00:00:00,5269,Cliente informado
3731,1160,3259,revisión completa de lubricacion y filtro de aire y verificación completa.,Finalizado,2026-03-21 00:00:00,2026-03-21 00:00:00,976,Cliente informado
3732,1920,4634,ajuste técnico de luces y luces para mejorar rendimiento.,Finalizado,2026-03-10 00:00:00,2026-03-14 00:00:00,4380,Entregado
