IdReparacion,IdMoto,IdUsuario,Descripcion,Estado,FechaInicio,FechaFin,Total,Fase
1304,788,2774,revisión completa de chip y calipers incluyendo ajuste final.,Finalizado,2026-03-07 00:00:00,2026-03-09 00:00:00,2616,Cliente informado
1305,779,4081,inspección avanzada de evaluación y inspección debido a desgaste.,Finalizado,2026-03-10 00:00:00,2026-03-12 00:00:00,1049,Cliente informado
1306,3454,766,servicio integral para filtro de aire y alineación por falla detectada.,Finalizado,2026-03-11 00:00:00,2026-03-14 00:00:00,6224,Cliente informado
1307,4694,4752,optimización del sistema pintura y vinilado según solicitud del cliente.,Entregado,2026-03-01 00:00:00,2026-03-01 00:00:00,1979,Entregado
1308,2018,3369,revisión completa de chip y actualización de software debido a desgaste.,Finalizado,2026-03-23 00:00:00,2026-03-23 00:00:00,2913,Entregado
1309,3570,2549,mantenimiento preventivo en distribución y suspensión incluyendo ajuste final.,Finalizado,2026-03-24 00:00:00,2026-03-25 00:00:00,2846,Cliente informado
1310,3826,1482,servicio integral para suspensión y embrague y verificación completa.,Finalizado,2026-03-27 00:00:00,2026-03-30 00:00:00,3908,Cliente informado
1311,1949,949,instalación y calibración de estético y modificación por falla detectada.,Finalizado,2026-03-12 00:00:00,2026-03-15 00:00:00,4439,Entregado
1312,4106,2717,revisión completa de distribución y radiador incluyendo ajuste final.,Finalizado,2026-03-21 00:00:00,2026-03-22 00:00:00,692,Entregado
1313,2860,5193,corrección especializada de niveles y filtro de aceite debido a desgaste.,Finalizado,2026-03-15 00:00:00,2026-03-15 00:00:00,2244,Cliente informado
1314,3243,3177,inspección avanzada de filtro de aceite y balanceo debido a desgaste.,Finalizado,2026-03-11 00:00:00,2026-03-12 00:00:00,5278,Entregado
1315,4780,5251,ajuste técnico de motor de arranque y batería según solicitud del cliente.,Finalizado,2026-03-17 00:00:00,2026-03-20 00:00:00,4757,Cliente informado
1316,2780,4120,ajuste técnico de distribución y radiador y verificación completa.,Finalizado,2026-03-11 00:00:00,2026-03-11 00:00:00,3337,Entregado
1317,1919,1331,inspección avanzada de alineación y filtro de aire con pruebas posteriores.,Finalizado,2026-03-26 00:00:00,2026-03-30 00:00:00,4401,Entregado
1318,4894,429,revisión completa de luces led y sonido para mejorar rendimiento.,Finalizado,2026-03-14 00:00:00,2026-03-17 00:00:00,677,Cliente informado
1319,4286,502,inspección avanzada de revisión general y diagnóstico con pruebas posteriores.,Finalizado,2026-03-23 00:00:00,2026-03-27 00:00:00,519,Entregado
1320,4404,4099,revisión completa de reprogramación y cámara y verificación completa.,En proceso,2026-03-19 00:00:00,2026-03-22 00:00:00,2671,Cliente informado
1321,356,5311,diagnóstico y reparación de revisión general y chequeo por falla detectada.,Finalizado,2026-03-04 00:00:00,2026-03-08 00:00:00,5116,Entregado
1322,658,4306,inspección avanzada de falla y diagnóstico incluyendo ajuste final.,Finalizado,2026-03-13 00:00:00,2026-03-17 00:00:00,3477,Entregado
1323,1134,5242,corrección especializada de amortiguadores y chasis incluyendo ajuste final.,Entregado,2026-03-01 00:00:00,2026-03-04 00:00:00,2650,Entregado
1324,886,12,inspección avanzada de caja de cambios y diferencial incluyendo ajuste final.,Finalizado,2026-03-03 00:00:00,2026-03-03 00:00:00,1400,Entregado
1325,3658,2567,optimización del sistema filtro de aire y niveles para mejorar rendimiento.,Finalizado,2026-03-17 00:00:00,2026-03-17 00:00:00,3316,Cliente informado
1326,829,3315,optimización del sistema caja de cambios y árbol de levas por falla detectada.,Finalizado,2026-03-26 00:00:00,2026-03-26 00:00:00,1420,Cliente informado
1327,1992,4676,corrección especializada de bujías y lubricacion para mejorar rendimiento.,Finalizado,2026-03-09 00:00:00,2026-03-11 00:00:00,2674,Cliente informado
1328,2496,180,diagnóstico y reparación de sensores y luces incluyendo ajuste final.,En proceso,2026-03-07 00:00:00,2026-03-07 00:00:00,5849,Entregado
1329,1957,2129,corrección especializada de gps y sonido debido a desgaste.,Finalizado,2026-03-23 00:00:00,2026-03-25 00:00:00,926,Entregado
1330,4351,3126,ajuste técnico de pistones y biela con pruebas posteriores.,Finalizado,2026-03-19 00:00:00,2026-03-20 00:00:00,5038,Cliente informado
1331,802,4972,ajuste técnico de falla y ruido según solicitud del cliente.,Finalizado,2026-03-16 00:00:00,2026-03-17 00:00:00,4687,Cliente informado
1332,2723,3492,mantenimiento preventivo en centralita y fallo eléctrico por falla detectada.,En proceso,2026-03-05 00:00:00,2026-03-06 00:00:00,5598,Cliente informado
1333,4257,2124,ajuste técnico de llantas deportivas y pintar carroceria con pruebas posteriores.,Finalizado,2026-03-25 00:00:00,2026-03-15 00:00:00,6252,Cliente informado
1334,2670,60,ajuste técnico de problema y diagnóstico incluyendo ajuste final.,Finalizado,2026-03-20 00:00:00,2026-03-20 00:00:00,4463,Cliente informado
1335,3562,5193,servicio integral para alternador y cableado debido a desgaste.,Finalizado,2026-03-24 00:00:00,2026-03-24 00:00:00,3366,Entregado
1336,4516,1341,ajuste técnico de sonido y actualización de software para mejorar rendimiento.,Finalizado,2026-03-27 00:00:00,2026-03-31 00:00:00,5244,Entregado
1337,1430,5059,revisión completa de escape deportivo y suspensión deportiva con pruebas posteriores.,Finalizado,2026-03-08 00:00:00,2026-03-12 00:00:00,5555,Cliente informado
1338,251,4162,ajuste técnico de cableado y sistema eléctrico por falla detectada.,Finalizado,2026-03-08 00:00:00,2026-02-26 00:00:00,3901,Entregado
1339,3163,2619,servicio integral para centralita y cableado y verificación completa.,Finalizado,2026-03-28 00:00:00,2026-03-30 00:00:00,4930,Cliente informado
1340,1323,2386,corrección especializada de test y chequeo con pruebas posteriores.,Entregado,2026-03-10 00:00:00,2026-03-12 00:00:00,5506,Cliente informado
1341,3417,4432,instalación y calibración de fibra de carbono y sonido y verificación completa.,Finalizado,2026-03-29 00:00:00,2026-03-31 00:00:00,823,Entregado
1342,4395,2737,corrección especializada de fallo eléctrico y luces debido a desgaste.,Finalizado,2026-03-15 00:00:00,2026-03-17 00:00:00,4593,Entregado
1343,3648,1756,optimización del sistema motor y caja de cambios con pruebas posteriores.,Finalizado,2026-03-07 00:00:00,2026-03-10 00:00:00,5839,Cliente informado
1344,95,4786,mantenimiento preventivo en inspección y evaluación para mejorar rendimiento.,Entregado,2026-03-24 00:00:00,2026-03-24 00:00:00,2189,Entregado
1345,1346,4052,revisión completa de chip y cromado y verificación completa.,Finalizado,2026-03-27 00:00:00,2026-03-30 00:00:00,2347,Cliente informado
1346,1069,3715,revisión completa de falla y escaneo debido a desgaste.,Finalizado,2026-03-08 00:00:00,2026-03-12 00:00:00,6447,Entregado
1347,1704,305,ajuste técnico de centralita y luces con pruebas posteriores.,Finalizado,2026-03-28 00:00:00,2026-03-29 00:00:00,3300,Cliente informado
1348,1141,1173,mantenimiento preventivo en suspensión y caja de cambios debido a desgaste.,Finalizado,2026-03-28 00:00:00,2026-03-31 00:00:00,5153,Entregado
1349,3737,3468,diagnóstico y reparación de centralita y sistema eléctrico para mejorar rendimiento.,Finalizado,2026-03-22 00:00:00,2026-03-23 00:00:00,662,Cliente informado
1350,295,2179,servicio integral para inspección y diagnóstico incluyendo ajuste final.,En proceso,2026-03-25 00:00:00,2026-03-26 00:00:00,4608,Entregado
1351,3722,460,revisión completa de alineación y cambio de aceite y verificación completa.,Finalizado,2026-02-28 00:00:00,2026-02-28 00:00:00,1933,Cliente informado
1352,4019,1202,instalación y calibración de niveles y alineación y verificación completa.,Finalizado,2026-03-21 00:00:00,2026-03-21 00:00:00,3365,Entregado
1353,292,3440,servicio integral para inspección y ruido con pruebas posteriores.,Finalizado,2026-03-01 00:00:00,2026-03-02 00:00:00,2365,Entregado
1354,4959,637,corrección especializada de sensores y fallo eléctrico debido a desgaste.,Finalizado,2026-03-09 00:00:00,2026-03-10 00:00:00,1467,Entregado
1355,4515,2714,mantenimiento preventivo en chequeo y filtro de aire según solicitud del cliente.,Finalizado,2026-03-28 00:00:00,2026-03-31 00:00:00,853,Cliente informado
1356,2492,2461,corrección especializada de cromado y tuning para mejorar rendimiento.,Finalizado,2026-03-01 00:00:00,2026-03-04 00:00:00,2018,Entregado
1357,243,186,revisión completa de revisión y revisión con pruebas posteriores.,En proceso,2026-03-02 00:00:00,2026-03-06 00:00:00,2541,Entregado
1358,295,2386,diagnóstico y reparación de sensores y alternador y verificación completa.,Finalizado,2026-03-01 00:00:00,2026-03-03 00:00:00,4751,Entregado
1359,4072,4080,mantenimiento preventivo en encendido y alternador según solicitud del cliente.,Finalizado,2026-03-29 00:00:00,2026-04-02 00:00:00,6125,Cliente informado
1360,2855,2646,optimización del sistema luces y encendido con pruebas posteriores.,Finalizado,2026-03-28 00:00:00,2026-03-29 00:00:00,5539,Entregado
1361,2737,4701,corrección especializada de distribución y carrocería por falla detectada.,Finalizado,2026-03-21 00:00:00,2026-03-21 00:00:00,1846,Entregado
1362,969,2859,mantenimiento preventivo en cromado y polarizado debido a desgaste.,Finalizado,2026-03-14 00:00:00,2026-03-15 00:00:00,5753,Entregado
1363,1888,2719,revisión completa de cableado y sensores incluyendo ajuste final.,Finalizado,2026-03-21 00:00:00,2026-03-23 00:00:00,4852,Cliente informado
1364,967,4338,servicio integral para performance y luces led incluyendo ajuste final.,Finalizado,2026-03-04 00:00:00,2026-03-06 00:00:00,2593,Cliente informado
1365,574,2405,optimización del sistema fallo eléctrico y fallo eléctrico y verificación completa.,Finalizado,2026-03-12 00:00:00,2026-03-13 00:00:00,5735,Cliente informado
1366,2968,936,mantenimiento preventivo en filtro de aire y cambio de aceite con pruebas posteriores.,Finalizado,2026-03-12 00:00:00,2026-03-13 00:00:00,6032,Entregado
1367,466,331,revisión completa de filtro de aceite y balanceo incluyendo ajuste final.,Finalizado,2026-03-10 00:00:00,2026-03-10 00:00:00,1197,Cliente informado
1368,794,2564,corrección especializada de niveles y cambio de aceite debido a desgaste.,Finalizado,2026-03-05 00:00:00,2026-03-06 00:00:00,1585,Cliente informado
1369,4809,3545,servicio integral para chequeo y problema para mejorar rendimiento.,Finalizado,2026-03-13 00:00:00,2026-03-17 00:00:00,6114,Cliente informado
1370,2474,5253,mantenimiento preventivo en revisión y cambio de aceite por falla detectada.,Finalizado,2026-03-18 00:00:00,2026-03-21 00:00:00,6214,Cliente informado
1371,3032,4385,diagnóstico y reparación de fibra de carbono y audio para mejorar rendimiento.,Finalizado,2026-03-08 00:00:00,2026-03-12 00:00:00,3860,Entregado
1372,3935,823,optimización del sistema encendido y fallo eléctrico por falla detectada.,Finalizado,2026-02-28 00:00:00,2026-03-01 00:00:00,956,Entregado
1373,925,4821,instalación y calibración de revisión general y test y verificación completa.,Finalizado,2026-03-05 00:00:00,2026-03-08 00:00:00,1705,Cliente informado
1374,310,1255,corrección especializada de balanceo y filtro de aire debido a desgaste.,En proceso,2026-03-18 00:00:00,2026-03-19 00:00:00,4253,Entregado
1375,2617,2520,inspección avanzada de alineación y lubricacion según solicitud del cliente.,Finalizado,2026-03-11 00:00:00,2026-03-11 00:00:00,3527,Cliente informado
1376,2496,180,diagnóstico y reparación de sistema eléctrico y cableado con pruebas posteriores.,En proceso,2026-03-07 00:00:00,2026-03-07 00:00:00,5430,Entregado
1377,4262,4895,optimización del sistema falla y ruido por falla detectada.,Finalizado,2026-03-04 00:00:00,2026-03-04 00:00:00,6153,Entregado
1378,4120,995,ajuste técnico de carrocería y chasis debido a desgaste.,Finalizado,2026-03-18 00:00:00,2026-03-20 00:00:00,871,Cliente informado
1379,3156,4101,corrección especializada de centralita y motor de arranque según solicitud del cliente.,Finalizado,2026-03-08 00:00:00,2026-03-12 00:00:00,5036,Entregado
1380,1313,4727,mantenimiento preventivo en escape deportivo y gps debido a desgaste.,Finalizado,2026-03-04 00:00:00,2026-03-07 00:00:00,5748,Entregado
1381,28,3267,corrección especializada de árbol de levas y transmisión según solicitud del cliente.,Finalizado,2026-03-15 00:00:00,2026-03-18 00:00:00,755,Cliente informado
1382,4844,1735,instalación y calibración de test y falla incluyendo ajuste final.,Finalizado,2026-03-24 00:00:00,2026-03-27 00:00:00,1543,Entregado
1383,3604,5322,corrección especializada de balanceo y chequeo según solicitud del cliente.,Finalizado,2026-03-24 00:00:00,2026-03-26 00:00:00,3289,Cliente informado
1384,1430,5059,mantenimiento preventivo en dirección y amortiguadores incluyendo ajuste final.,Finalizado,2026-03-08 00:00:00,2026-03-12 00:00:00,5611,Cliente informado
1385,1554,4676,diagnóstico y reparación de potencia y cámara incluyendo ajuste final.,Finalizado,2026-03-20 00:00:00,2026-03-22 00:00:00,1833,Cliente informado
1386,1006,4633,optimización del sistema lubricacion y lubricacion para mejorar rendimiento.,Finalizado,2026-03-12 00:00:00,2026-03-15 00:00:00,5017,Entregado
1387,2403,769,mantenimiento preventivo en chequeo y bujías por falla detectada.,Finalizado,2026-03-07 00:00:00,2026-03-08 00:00:00,4702,Entregado
1388,3803,5209,revisión completa de alineación y chequeo y verificación completa.,Entregado,2026-03-12 00:00:00,2026-03-14 00:00:00,5269,Cliente informado
1389,3420,2400,diagnóstico y reparación de carrocería y pistones debido a desgaste.,Finalizado,2026-03-13 00:00:00,2026-03-14 00:00:00,2122,Entregado
1390,3535,3808,revisión completa de ruido y escaneo por falla detectada.,Finalizado,2026-03-10 00:00:00,2026-03-14 00:00:00,2117,Cliente informado
1391,3163,2619,instalación y calibración de filtro de aire y niveles incluyendo ajuste final.,Finalizado,2026-03-28 00:00:00,2026-03-30 00:00:00,3422,Cliente informado
1392,794,2564,ajuste técnico de cableado y cableado debido a desgaste.,Finalizado,2026-03-05 00:00:00,2026-03-06 00:00:00,2680,Cliente informado
1393,3717,4753,inspección avanzada de filtro de aceite y bujías y verificación completa.,Finalizado,2026-03-23 00:00:00,2026-03-25 00:00:00,6447,Entregado
1394,2137,4386,corrección especializada de filtro de aceite y chequeo para mejorar rendimiento.,Finalizado,2026-03-03 00:00:00,2026-03-03 00:00:00,5060,Entregado
1395,783,192,inspección avanzada de pintar carroceria y actualización de software por falla detectada.,Finalizado,2026-03-01 00:00:00,2026-03-04 00:00:00,2600,Cliente informado
1396,3282,925,corrección especializada de radiador y radiador debido a desgaste.,Finalizado,2026-03-19 00:00:00,2026-03-19 00:00:00,6093,Cliente informado
1397,3476,1832,mantenimiento preventivo en encendido y batería según solicitud del cliente.,Finalizado,2026-03-16 00:00:00,2026-03-18 00:00:00,1010,Entregado
1398,3252,1302,mantenimiento preventivo en escape deportivo y calipers y verificación completa.,Finalizado,2026-03-14 00:00:00,2026-03-16 00:00:00,3951,Cliente informado
1399,4471,257,instalación y calibración de revisión general y problema y verificación completa.,Finalizado,2026-03-15 00:00:00,2026-03-17 00:00:00,1470,Entregado
1400,1949,949,optimización del sistema sistema eléctrico y sensores incluyendo ajuste final.,Finalizado,2026-03-12 00:00:00,2026-03-15 00:00:00,1010,Entregado
1401,1564,1811,diagnóstico y reparación de árbol de levas y motor por falla detectada.,Finalizado,2026-03-27 00:00:00,2026-03-29 00:00:00,3151,Entregado
1402,486,792,mantenimiento preventivo en ruido y revisión general para mejorar rendimiento.,Finalizado,2026-03-24 00:00:00,2026-03-14 00:00:00,971,Entregado
1403,4920,1858,corrección especializada de árbol de levas y culata incluyendo ajuste final.,Finalizado,2026-03-06 00:00:00,2026-03-10 00:00:00,759,Entregado
1404,1221,1536,servicio integral para revisión general y falla y verificación completa.,Entregado,2026-03-09 00:00:00,2026-03-09 00:00:00,1358,Cliente informado
1405,4633,1876,servicio integral para revisión general y diagnóstico y verificación completa.,Finalizado,2026-03-23 00:00:00,2026-03-24 00:00:00,845,Cliente informado
1406,135,606,corrección especializada de fallo eléctrico y batería y verificación completa.,Finalizado,2026-03-14 00:00:00,2026-03-15 00:00:00,3148,Entregado
1407,2447,387,corrección especializada de sensores y motor de arranque debido a desgaste.,Finalizado,2026-03-24 00:00:00,2026-03-25 00:00:00,1353,Entregado
1408,756,3657,diagnóstico y reparación de falla y falla y verificación completa.,Finalizado,2026-03-07 00:00:00,2026-03-09 00:00:00,2546,Cliente informado
1409,3886,418,optimización del sistema diferencial y radiador con pruebas posteriores.,Finalizado,2026-03-18 00:00:00,2026-03-22 00:00:00,1278,Cliente informado
1410,2699,4387,ajuste técnico de chequeo y filtro de aceite para mejorar rendimiento.,Finalizado,2026-03-19 00:00:00,2026-03-22 00:00:00,1178,Cliente informado
1411,318,1978,inspección avanzada de radiador y distribución con pruebas posteriores.,Finalizado,2026-03-09 00:00:00,2026-03-12 00:00:00,1468,Cliente informado
1412,4780,5251,corrección especializada de distribución y embrague según solicitud del cliente.,Finalizado,2026-03-17 00:00:00,2026-03-20 00:00:00,3858,Cliente informado
1413,161,1051,servicio integral para bujías y lubricacion y verificación completa.,Finalizado,2026-03-28 00:00:00,2026-03-28 00:00:00,2482,Cliente informado
1414,1160,3259,servicio integral para alternador y motor de arranque debido a desgaste.,Finalizado,2026-03-21 00:00:00,2026-03-21 00:00:00,3872,Cliente informado
1415,4369,4843,servicio integral para luces y luces para mejorar rendimiento.,Finalizado,2026-03-07 00:00:00,2026-03-10 00:00:00,1839,Cliente informado
1416,3895,1935,corrección especializada de problema y problema por falla detectada.,Finalizado,2026-03-05 00:00:00,2026-03-05 00:00:00,4961,Cliente informado
1417,357,301,mantenimiento preventivo en distribución y distribución según solicitud del cliente.,Finalizado,2026-03-24 00:00:00,2026-03-24 00:00:00,3048,Cliente informado
1418,2563,4306,diagnóstico y reparación de cigüeñal y bomba de agua con pruebas posteriores.,Finalizado,2026-03-24 00:00:00,2026-03-28 00:00:00,2180,Cliente informado
1419,3352,47,mantenimiento preventivo en radiador y motor y verificación completa.,Finalizado,2026-03-05 00:00:00,2026-03-05 00:00:00,2164,Cliente informado
1420,295,2386,servicio integral para problema y diagnóstico con pruebas posteriores.,Finalizado,2026-03-01 00:00:00,2026-03-03 00:00:00,4183,Entregado
1421,3102,4494,mantenimiento preventivo en niveles y bujías debido a desgaste.,Finalizado,2026-03-27 00:00:00,2026-03-30 00:00:00,3893,Cliente informado
1422,1285,4779,corrección especializada de inspección y revisión general según solicitud del cliente.,Finalizado,2026-03-02 00:00:00,2026-02-20 00:00:00,1572,Cliente informado
1423,4068,1264,mantenimiento preventivo en sensores y sistema eléctrico incluyendo ajuste final.,En proceso,2026-03-26 00:00:00,2026-03-26 00:00:00,5513,Cliente informado
1424,2696,773,optimización del sistema sensores y fallo eléctrico para mejorar rendimiento.,Finalizado,2026-03-19 00:00:00,2026-03-22 00:00:00,4937,Entregado
1425,1707,3637,optimización del sistema caja de cambios y carrocería incluyendo ajuste final.,Finalizado,2026-03-08 00:00:00,2026-03-12 00:00:00,1840,Cliente informado
1426,1967,1891,diagnóstico y reparación de cambio de aceite y alineación y verificación completa.,Finalizado,2026-03-02 00:00:00,2026-02-20 00:00:00,5849,Entregado
1427,4610,4894,optimización del sistema cigüeñal y motor para mejorar rendimiento.,Finalizado,2026-03-10 00:00:00,2026-03-14 00:00:00,1007,Entregado
1428,696,537,instalación y calibración de balanceo y lubricacion según solicitud del cliente.,Finalizado,2026-03-27 00:00:00,2026-03-28 00:00:00,1113,Cliente informado
1429,3032,4385,ajuste técnico de bomba de agua y embrague por falla detectada.,Finalizado,2026-03-08 00:00:00,2026-03-12 00:00:00,3162,Entregado
1430,135,606,optimización del sistema diagnóstico y falla para mejorar rendimiento.,Finalizado,2026-03-14 00:00:00,2026-03-15 00:00:00,4622,Entregado
1431,1273,3166,optimización del sistema llantas deportivas y tuning con pruebas posteriores.,Finalizado,2026-03-01 00:00:00,2026-03-02 00:00:00,3502,Entregado
1432,4924,2464,inspección avanzada de centralita y sensores para mejorar rendimiento.,Finalizado,2026-03-23 00:00:00,2026-03-26 00:00:00,2108,Entregado
1433,2447,786,servicio integral para escape deportivo y performance según solicitud del cliente.,Finalizado,2026-03-23 00:00:00,2026-03-26 00:00:00,1336,Entregado
1434,4515,2714,mantenimiento preventivo en falla y escaneo para mejorar rendimiento.,Finalizado,2026-03-28 00:00:00,2026-03-31 00:00:00,1775,Cliente informado
1435,3850,1068,optimización del sistema diagnóstico y ruido debido a desgaste.,Finalizado,2026-03-08 00:00:00,2026-03-12 00:00:00,4265,Entregado
1436,3315,1733,servicio integral para luces y sistema eléctrico para mejorar rendimiento.,Finalizado,2026-03-02 00:00:00,2026-03-06 00:00:00,4494,Cliente informado
1437,4271,3014,mantenimiento preventivo en caja de cambios y motor debido a desgaste.,Finalizado,2026-03-26 00:00:00,2026-03-28 00:00:00,1645,Cliente informado
1438,1461,4987,mantenimiento preventivo en inspección y problema según solicitud del cliente.,Finalizado,2026-03-22 00:00:00,2026-03-23 00:00:00,3752,Entregado
1439,231,2594,corrección especializada de escape deportivo y modificación y verificación completa.,Finalizado,2026-03-10 00:00:00,2026-03-12 00:00:00,5279,Cliente informado
1440,466,331,diagnóstico y reparación de revisión general y test con pruebas posteriores.,Finalizado,2026-03-10 00:00:00,2026-03-10 00:00:00,5155,Cliente informado
1441,4829,1653,corrección especializada de escaneo y diagnóstico según solicitud del cliente.,Finalizado,2026-03-29 00:00:00,2026-03-30 00:00:00,4868,Entregado
1442,682,2567,diagnóstico y reparación de luces y batería incluyendo ajuste final.,Finalizado,2026-03-26 00:00:00,2026-03-16 00:00:00,3269,Entregado
1443,4154,4528,corrección especializada de distribución y caja de cambios por falla detectada.,Finalizado,2026-03-08 00:00:00,2026-03-12 00:00:00,5054,Entregado
1444,52,2054,revisión completa de alternador y luces incluyendo ajuste final.,En proceso,2026-02-28 00:00:00,2026-03-03 00:00:00,2680,Entregado
1445,4358,4167,corrección especializada de pintura y pantalla por falla detectada.,Finalizado,2026-03-16 00:00:00,2026-03-18 00:00:00,1926,Cliente informado
1446,4072,4080,servicio integral para escaneo y inspección según solicitud del cliente.,Finalizado,2026-03-29 00:00:00,2026-04-02 00:00:00,1046,Cliente informado
1447,3464,4605,revisión completa de motor de arranque y sistema eléctrico debido a desgaste.,Finalizado,2026-03-06 00:00:00,2026-03-06 00:00:00,3679,Cliente informado
1448,3195,248,diagnóstico y reparación de kit aerodinámico y performance y verificación completa.,Entregado,2026-03-05 00:00:00,2026-03-09 00:00:00,2952,Cliente informado
1449,2146,3659,diagnóstico y reparación de cableado y sistema eléctrico incluyendo ajuste final.,Finalizado,2026-03-05 00:00:00,2026-03-06 00:00:00,3734,Entregado
1450,808,1423,diagnóstico y reparación de carrocería y dirección y verificación completa.,Finalizado,2026-03-28 00:00:00,2026-03-29 00:00:00,5246,Cliente informado
1451,1221,1536,optimización del sistema encendido y batería para mejorar rendimiento.,Entregado,2026-03-09 00:00:00,2026-03-09 00:00:00,3112,Cliente informado
1452,3720,3889,optimización del sistema vinilado y actualización de software según solicitud del cliente.,Finalizado,2026-03-26 00:00:00,2026-03-30 00:00:00,1032,Entregado
1453,1707,3637,revisión completa de encendido y encendido con pruebas posteriores.,Finalizado,2026-03-08 00:00:00,2026-03-12 00:00:00,5489,Cliente informado
1454,3167,656,mantenimiento preventivo en revisión general y evaluación con pruebas posteriores.,Finalizado,2026-03-29 00:00:00,2026-03-29 00:00:00,5582,Entregado
1455,4090,4645,corrección especializada de alerón y turbo con pruebas posteriores.,Finalizado,2026-03-07 00:00:00,2026-03-11 00:00:00,4580,Cliente informado
1456,1869,68,corrección especializada de escape deportivo y modificación debido a desgaste.,Finalizado,2026-03-14 00:00:00,2026-03-14 00:00:00,2424,Cliente informado
1457,2137,4386,revisión completa de revisión y chequeo y verificación completa.,Finalizado,2026-03-03 00:00:00,2026-03-03 00:00:00,6384,Entregado
1458,3697,3606,servicio integral para potencia y alerón con pruebas posteriores.,Finalizado,2026-03-12 00:00:00,2026-03-14 00:00:00,1152,Entregado
1459,686,23,inspección avanzada de diferencial y transmisión y verificación completa.,Finalizado,2026-03-08 00:00:00,2026-03-09 00:00:00,1614,Cliente informado
1460,1285,565,instalación y calibración de revisión general y ruido incluyendo ajuste final.,Finalizado,2026-03-06 00:00:00,2026-02-24 00:00:00,1162,Entregado
1461,4610,3782,optimización del sistema falla y inspección con pruebas posteriores.,Finalizado,2026-03-29 00:00:00,2026-04-02 00:00:00,3269,Entregado
1462,3513,2464,corrección especializada de lubricacion y filtro de aire incluyendo ajuste final.,Finalizado,2026-03-02 00:00:00,2026-03-05 00:00:00,6279,Cliente informado
1463,1519,5237,inspección avanzada de amortiguadores y biela incluyendo ajuste final.,Finalizado,2026-03-18 00:00:00,2026-03-22 00:00:00,2850,Cliente informado
1464,1346,4052,optimización del sistema evaluación y falla según solicitud del cliente.,Finalizado,2026-03-27 00:00:00,2026-03-30 00:00:00,6216,Cliente informado
